{
    "icon": "fas-syringe",
    "fields": [
        "{amenity/waste_basket}"
    ],
    "moreFields": [
        "{amenity/waste_basket}"
    ],
    "geometry": [
        "point",
        "vertex"
    ],
    "tags": {
        "amenity": "waste_basket",
        "waste": "sharps"
    },
    "reference": {
        "key": "waste",
        "value": "sharps"
    },
    "terms": [
        "needle",
        "syringe"
    ],
    "name": "Sharps Container"
}
