{
    "icon": "maki-cemetery",
    "fields": [
        "religion",
        "address"
    ],
    "moreFields": [
        "{@templates/contact}",
        "gnis/feature_id-US",
        "operator"
    ],
    "geometry": [
        "point",
        "area"
    ],
    "tags": {
        "amenity": "grave_yard"
    },
    "terms": [
        "burial ground",
        "cemetary",
        "cemetery",
        "churchyard",
        "columbarium",
        "grave yard",
        "graveyard",
        "graveyards",
        "mausoleum",
        "tomb"
    ],
    "name": "Graveyard"
}
