{
    "icon": "iD-boundary",
    "fields": [
        "name",
        "admin_level"
    ],
    "moreFields": [
        "gnis/feature_id-US"
    ],
    "geometry": [
        "relation"
    ],
    "tags": {
        "type": "boundary",
        "boundary": "administrative"
    },
    "reference": {
        "key": "boundary",
        "value": "administrative"
    },
    "name": "Administrative Boundary",
    "relation": {
        "reference": "boundary",
        "allowDuplicateMembers": false,
        "role_labels": {
            "inner": "{area.role_labels.inner}",
            "outer": "{area.role_labels.outer}",
            "label": "Label",
            "admin_centre": "Capital / Seat"
        },
        "members": [
            {
                "role": "outer",
                "geometry": [
                    "line",
                    "area"
                ],
                "min": 1
            },
            {
                "role": "inner",
                "geometry": [
                    "line",
                    "area"
                ]
            },
            {
                "role": "label",
                "geometry": [
                    "point",
                    "vertex"
                ],
                "matchTags": [
                    {
                        "place": "*"
                    }
                ],
                "max": 1
            },
            {
                "role": "admin_centre",
                "geometry": [
                    "point",
                    "vertex"
                ],
                "matchTags": [
                    {
                        "place": "*"
                    }
                ],
                "max": 1
            }
        ]
    }
}
