{
    "icon": "maki-pitch",
    "geometry": [
        "area"
    ],
    "fields": [
        "name"
    ],
    "moreFields": [
        "{@templates/contact}",
        "address"
    ],
    "tags": {
        "landuse": "recreation_ground"
    },
    "terms": [
        "playing fields",
        "recreation grounds"
    ],
    "name": "Recreation Ground"
}
