{
    "icon": "maki-water",
    "fields": [
        "name",
        "water",
        "intermittent"
    ],
    "moreFields": [
        "fishing",
        "gnis/feature_id-US",
        "salt",
        "tidal"
    ],
    "geometry": [
        "area"
    ],
    "tags": {
        "natural": "water"
    },
    "name": "Water"
}
