{
    "icon": "temaki-laundry",
    "geometry": [
        "point",
        "area"
    ],
    "terms": [
        "air conditioner",
        "appliance",
        "appliance stores",
        "dishwasher",
        "dryer",
        "freezer",
        "fridge",
        "grill",
        "kitchen",
        "oven",
        "refrigerator",
        "stove",
        "washer",
        "washing machine",
        "white goods"
    ],
    "fields": [
        "{shop}"
    ],
    "moreFields": [
        "{shop}"
    ],
    "tags": {
        "shop": "appliance"
    },
    "name": "Appliance Store"
}
