{
    "icon": "temaki-real_estate_agency",
    "fields": [
        "{shop}"
    ],
    "moreFields": [
        "{shop}"
    ],
    "geometry": [
        "point",
        "area"
    ],
    "tags": {
        "shop": "estate_agent"
    },
    "terms": [
        "estate agent",
        "real estate",
        "real estate agent",
        "real estate office"
    ],
    "name": "Real Estate Agency"
}
