{
    "icon": "fas-charging-station",
    "fields": [
        "{amenity/charging_station}"
    ],
    "moreFields": [
        "{amenity/charging_station}"
    ],
    "geometry": [
        "point",
        "vertex",
        "area"
    ],
    "tags": {
        "amenity": "charging_station",
        "bicycle": "yes"    
    },
    "terms": [
        "EV",
        "Electric Bicycle",
        "Pedelec Charging",
        "E-Bike"
    ],
    "reference": {
        "key": "amenity",
        "value": "charging_station"
    },
    "name": "Charging Station for Electric Bicycles"
}
