{
    "icon": "maki-confectionery",
    "geometry": [
        "point",
        "area"
    ],
    "terms": [
        "candy",
        "candy makers",
        "sweet"
    ],
    "fields": [
        "{craft}"
    ],
    "moreFields": [
        "{craft}",
        "fhrs/id-GB"
    ],
    "tags": {
        "craft": "confectionery"
    },
    "name": "Candy Maker"
}
