{
    "icon": "maki-town-hall",
    "fields": [
        "community_centre",
        "{amenity/community_centre}"
    ],
    "moreFields": [
        "{amenity/community_centre}"
    ],
    "geometry": [
        "point",
        "area"
    ],
    "tags": {
        "amenity": "community_centre",
        "community_centre": "family_centre"
    },
    "reference": {
        "key": "community_centre",
        "value": "family_centre"
    },
    "name": "Family Center",
    "terms": [
        "family centre"
    ]
}
