{
    "icon": "temaki-hinduism",
    "geometry": [
        "point",
        "area"
    ],
    "terms": [
        "traditional indian medicine"
    ],
    "fields": [
        "{healthcare/alternative}"
    ],
    "moreFields": [
        "{healthcare/alternative}"
    ],
    "tags": {
        "healthcare": "alternative",
        "healthcare:speciality": "ayurveda"
    },
    "reference": {
        "key": "healthcare:speciality",
        "value": "ayurveda"
    },
    "name": "Ayurveda Practitioner"
}
