{
    "icon": "fas-motorcycle",
    "fields": [
        "capacity_parking",
        "operator",
        "covered",
        "access_simple"
    ],
    "geometry": [
        "point",
        "vertex",
        "area"
    ],
    "tags": {
        "amenity": "motorcycle_parking"
    },
    "terms": [
        "motorbike parking"
    ],
    "name": "Motorcycle Parking"
}
