{
    "icon": "temaki-tree_row",
    "fields": [
        "leaf_type",
        "leaf_cycle",
        "denotation"
    ],
    "moreFields": [
        "species/wikidata"
    ],
    "geometry": [
        "line"
    ],
    "tags": {
        "natural": "tree_row"
    },
    "terms": [
        "tree line",
        "tree rows"
    ],
    "name": "Tree Row"
}
