{
    "icon": "maki-information",
    "fields": [
        "information",
        "operator",
        "address",
        "building_area_yes"
    ],
    "moreFields": [
        "level"
    ],
    "geometry": [
        "point",
        "vertex",
        "area"
    ],
    "tags": {
        "tourism": "information"
    },
    "name": "Information"
}
