{
    "icon": "maki-zoo",
    "fields": [
        "name",
        "operator",
        "species/wikidata"
    ],
    "moreFields": [
        "{attraction}",
        "opening_hours"
    ],
    "geometry": [
        "point",
        "area"
    ],
    "terms": [
        "amphibian",
        "animal enclosures",
        "animal park",
        "aquarium",
        "bear",
        "bird",
        "fish",
        "insect",
        "lion",
        "mammal",
        "monkey",
        "penguin",
        "reptile",
        "safari",
        "theme park",
        "tiger",
        "zoo"
    ],
    "tags": {
        "attraction": "animal"
    },
    "name": "Animal Enclosure"
}
