{
    "icon": "maki-art-gallery",
    "geometry": [
        "point",
        "area"
    ],
    "terms": [
        "art",
        "art stores",
        "exhibition",
        "gallery"
    ],
    "fields": [
        "{shop}"
    ],
    "moreFields": [
        "{shop}"
    ],
    "tags": {
        "shop": "art"
    },
    "name": "Art Store"
}
