{
    "icon": "temaki-lipstick",
    "geometry": [
        "point",
        "area"
    ],
    "fields": [
        "{shop}"
    ],
    "moreFields": [
        "{shop}"
    ],
    "tags": {
        "shop": "cosmetics"
    },
    "terms": [
        "cosmetics stores",
        "make-up",
        "makeup"
    ],
    "name": "Cosmetics Store"
}
