{
    "icon": "temaki-horizontal_bar",
    "geometry": [
        "point",
        "area"
    ],
    "fields": [
        "{leisure/fitness_station}"
    ],
    "moreFields": [
        "{leisure/fitness_station}"
    ],
    "tags": {
        "leisure": "fitness_station",
        "fitness_station": "horizontal_bar"
    },
    "addTags": {
        "leisure": "fitness_station",
        "fitness_station": "horizontal_bar",
        "sport": "fitness"
    },
    "reference": {
        "key": "leisure",
        "value": "fitness_station"
    },
    "terms": [
        "bar",
        "chin up",
        "chinup",
        "exercise",
        "exercise horizontal bars",
        "fitness",
        "gym",
        "pull up",
        "pullup",
        "trim trail"
    ],
    "name": "Exercise Horizontal Bar"
}
