{
    "icon": "temaki-shinto",
    "fields": [
        "{man_made/ceremonial_gate}",
        "colour"
    ],
    "moreFields": [
        "{man_made/ceremonial_gate}"
    ],
    "geometry": [
        "point",
        "vertex",
        "line"
    ],
    "terms": [
        "japanese gate",
        "shinto shrine",
        "toriis"
    ],
    "tags": {
        "ceremonial_gate": "torii"
    },
    "addTags": {
        "man_made": "ceremonial_gate",
        "ceremonial_gate": "torii"
    },
    "reference": {
        "key": "ceremonial_gate",
        "value": "torii"
    },
    "name": "Torii"
}
