{
    "icon": "maki-town-hall",
    "fields": [
        "community_centre",
        "{amenity/community_centre}"
    ],
    "moreFields": [
        "{amenity/community_centre}"
    ],
    "geometry": [
        "point",
        "area"
    ],
    "terms": [
        "community center",
        "community halls"
    ],
    "tags": {
        "amenity": "community_centre",
        "community_centre": "community_hall"
    },
    "reference": {
        "key": "community_centre",
        "value": "community_hall"
    },
    "name": "Community Hall"
}
