{
    "icon": "fas-biking",
    "fields": [
        "{highway/path}",
        "access_vehicle"
    ],
    "moreFields": [
        "{highway/path}"
    ],
    "geometry": [
        "line"
    ],
    "tags": {
        "highway": "path",
        "bicycle_road": "yes"
    },
    "addTags": {
        "bicycle": "designated"
    },
    "reference": {
        "key": "bicycle_road",
        "value": "yes"
    },
    "terms": [
        "road",
        "street",
        "bicycle_road"
    ],
    "name": "Bicycle Road (Path)",
    "searchable": false
}
