{
    "icon": "maki-volleyball",
    "geometry": [
        "area",
        "point"
    ],
    "fields": [
        "{leisure/pitch}"
    ],
    "moreFields": [
        "{leisure/pitch}"
    ],
    "tags": {
        "leisure": "pitch",
        "sport": "volleyball"
    },
    "reference": {
        "key": "sport",
        "value": "volleyball"
    },
    "terms": [
        "volleyball courts",
        "volleyball net"
    ],
    "name": "Volleyball Court"
}
