{
    "icon": "temaki-hammer_shoe",
    "geometry": [
        "point",
        "area"
    ],
    "fields": [
        "{shop}"
    ],
    "moreFields": [
        "{shop}"
    ],
    "tags": {
        "shop": "shoe_repair"
    },
    "terms": [
        "cobbler",
        "shoe repair shops"
    ],
    "name": "Shoe Repair Shop"
}
