{
    "icon": "temaki-valley",
    "fields": [
        "name",
        "ele_node"
    ],
    "moreFields": [
        "{natural}"
    ],
    "geometry": [
        "vertex",
        "point",
        "line"
    ],
    "tags": {
        "natural": "valley"
    },
    "terms": [
        "canyon",
        "dale",
        "dell",
        "dene",
        "depression",
        "glen",
        "gorge",
        "gulley",
        "gully",
        "gultch",
        "hollow",
        "ravine",
        "rift",
        "vale",
        "valleys"
    ],
    "name": "Valley"
}
